{
  "id": "t7_matrix_run",
  "task_type": "matrix_build",
  "tier": 2,
  "difficulty": 6,
  "time_estimate_sec": 480,

  "context": {
    "sentences": [
      "He is running to catch the bus.",
      "She runs fast around the track.",
      "Yesterday, she ran the race."
    ],
    "target_word": "running",
    "gloss": "moving quickly on foot (in progress)",
    "audio": {
      "src": "/audio/t7_matrix_run.mp3",
      "caption": "Listen to the sentences"
    }
  },

  "targets": {
    "base": "run",
    "prefixes": ["re"],
    "suffixes": ["s", "ing", "ed"],

    "words": [
      "run",
      "runs",
      "running",
      "rerun",
      "reruns",
      "rerunning"
    ],

    "family_relatives": [
      {
        "word": "ran",
        "relation_note": "Meaning-related family member, but not built by adding a suffix to the spelling <run>."
      }
    ],

    "twin_bases": [
      {
        "base": "ran",
        "example_words": ["ran"],
        "note": "Twin-base/alternate historical form linked to the meaning family of <run>."
      }
    ]
  },

  "prompts": {
    "stem": "Build a matrix for this base. Select words that keep the base spelling stable, then prove one with a word sum and a join note.",
    "questions": [
      { "id": "q1", "text": "In the sentence context, what does <running> mean?", "intent": "meaning" },
      { "id": "q2", "text": "What is the base that carries the core meaning across the matrix words?", "intent": "structure" },
      { "id": "q3", "text": "Use the matrix to generate related words that keep the base spelling stable. Select at least four.", "intent": "family" },
      { "id": "q4", "text": "Choose one selected word and write a word sum that resembles it. Include a join note.", "intent": "join_convention" }
    ],
    "supports": [
      { "type": "sentence_frame", "content": "In this sentence, <running> means ________." },
      { "type": "sentence_frame", "content": "The base in this word family is <____> because it carries the core meaning across related words." },
      { "type": "sentence_frame", "content": "One word I built is <____> = <base> + <affix>. The affix adds the meaning ________." },
      { "type": "sentence_frame", "content": "At the join, the spelling ________ because ________." }
    ]
  },

  "response": { "mode": "matrix_builder" },

  "scoring": {
    "rubric": [
      { "criterion": "Selects multiple matrix-buildable words that preserve the base spelling", "max_points": 3 },
      { "criterion": "Produces a word sum proof that resembles the chosen word", "max_points": 2 },
      { "criterion": "Includes a join note supported by letter evidence", "max_points": 2 }
    ],
    "error_tags": ["meaning_error", "structure_error", "family_error", "join_error"],
    "mastery_threshold": 0.75
  },

  "metadata": {
    "tags": ["matrix", "cvc_double", "tier2", "word_family", "ed_contrast"],
    "notes_for_teacher": "Matrix words preserve the base spelling <run>. The form <run + ed> is not standard English. Use this to contrast regular suffixing with the twin-base form <ran>."
  }
}
